title,location,url,salary,date_posted,date_updated,work_mode,contract_type,work_time,industry,position_level,experience_required,description,scraped_date,saved_to_db
"Inspektor Wojewódzki, Wydział Nieruchomości i Skarbu Państwa",Gdańsk ŚródmieścieOkopowa 21/27,https://ogloszenia.trojmiasto.pl/praca-zatrudnie/inspektor-wojewodzki-wydzial-nieruchomosci-i-skarbu-panstwa-ogl66088522.html,,19.05.2025,19.05.2025,Stacjonarna,Umowa o pracę,Pełny etat,Wsparcie administracyjne,Pracownik biurowy,,"Pomorski Urząd Wojewódzki w Gdańsku80-810 Gdańsk Okopowa 21/27Ogłoszenie nr 151973 / 17.05.2025Inspektor Wojewódzki do spraw: gospodarowania nieruchomościami i ochrony interesów Skarbu Państwa w Wydziale Nieruchomości i Skarbu Państwa, Odział Gospodarki Nieruchomościami i Skarbu Państwa#administracja publicznaLiczba stanowisk: 1Wymiar etatu: 1Status: nabór w tokuMiejsce pracy: ul. Okopowa 21/27Ważne do: 27.05.2025Wynagrodzenie zasadnicze: 6720,00 zł bruttoCzym będziesz się zajmowaćOsoba na tym stanowisku:Rozpatruje wnioski starostów o wyrażenie zgody na dokonanie czynności prawnych, w szczególności na: nabycie nieruchomości do zasobu Skarbu Państwa, zbycie nieruchomości Skarbu Państwa, ich wydzierżawienie, wynajęcie,użyczenie, darowiznę, oraz przygotowuje projekty zarządzeń i pism dotyczące wyrażenia tej zgody albo jej odmowyPrzeprowadza kontrole starostów w zakresie gospodarki nieruchomościami Skarbu PaństwaRealizuje zadania nadzorcze wobec starostów wykonujących zadanie zlecone z zakresu administracji publicznej, w tym m.in. planuje podział dotacji celowych i dochodów starostów związanych z realizacją zadań zleconych z zakresu administracji rządowejWeryfikuje pod względem formalno-prawnym i analizuje poprawność sporządzenia operatów szacunkowych sporządzanych na potrzeby prowadzonych przez starostę spraw dotyczących zbycia lub nabycia nieruchomościWindykuje należności przysługujące Skarbowi Państwa, wchodzące w skład mienia pozostałego po przedsiębiorstwach państwowych wykreślonych z rejestru przedsiębiorcówProwadzi sprawy dotyczące darowizn na rzecz Skarbu Państwa oraz spadków przypadających Skarbowi Państwa, w tym długów spadkowychGospodaruje mieniem Skarbu Państwa, zapewnia wycenę jego składników oraz organizuje ich zabezpieczenie przed utratą, uszkodzeniem lub zniszczeniem, sprzedaż lub udostępnienie do odpłatnego korzystaniaRozpatruje skargi i wnioski, a także przygotowuje odpowiedzi na interpelacje oraz zapytania posłów i senatorówKogo poszukujemyPotrzebne ci będą(wymagania niezbędne)Wykształcenie: wyższeZnajomość ustaw: o gospodarce nieruchomościami (Dział I i II), o służbie cywilnej, o wojewodzie i administracji rządowej w województwie oraz Kodeksu postępowania administracyjnego (Dział I i II)W służbie cywilnej nie może być zatrudniona osoba, która w okresie od dnia 22 lipca 1944 r. do dnia 31 lipca 1990 r. pracowała lub pełniła służbę w organach bezpieczeństwa państwa lub była współpracownikiem tych organów w rozumieniu przepisów ustawy z dnia 18 października 2006 r. o ujawnianiu informacji o dokumentach organów bezpieczeństwa państwa z lat 1944–1990 oraz treści tych dokumentów - nie dotyczy kandydatek/kandydatów urodzonych 1 sierpnia 1972 r. lub później. Osoba wybrana do zatrudnienia będzie musiała złożyć oświadczenie lustracyjne, jeśli urodziła się przed 1 sierpnia 1972 r.Posiadanie obywatelstwa polskiegoKorzystanie z pełni praw publicznychNieskazanie prawomocnym wyrokiem za umyślne przestępstwo lub umyślne przestępstwo skarboweDodatkowym atutem będzie (wymagania dodatkowe)Wykształcenie: wyższe na kierunku prawo lub administracjaDoświadczenie zawodowe co najmniej 1 rok w administracji publicznejCo oferujemyMożliwość wyjścia w celu załatwienia ważnej sprawyKarty sportowe lub dofinansowanie zajęć sportowo-rekreacyjnychDopłata do biletów na imprezy kulturalnePomieszczenie lub stojaki na rowery na terenie urzęduDofinansowanie do wypoczynku pracownikówDofinansowanie do wypoczynku dzieci pracownikówDodatek za wysługę lat od 5% do 20% wynagrodzenia zasadniczego, w zależności od udokumentowanego stażu pracyMożliwość dofinansowania do legitymacji ze zniżką 50% na przejazdy PKP, SKM, PKM po przepracowaniu co najmniej 6 miesięcyDodatkowe wynagrodzenie roczne tzw. ""trzynastka""Wsparcie psychologiczneDostępnośćNasz urząd jest pracodawcą równych szans. Aplikacje rozważane są z równą uwagą bez względu na płeć, wiek, niepełnosprawność, rasę, narodowość, przekonania polityczne, przynależność związkową, pochodzenie etniczne, wyznanie, orientację seksualną czy też jakąkolwiek inną cechę prawnie chronioną.Jako osoba z niepełnosprawnością nie możesz skorzystać z pierwszeństwa w zatrudnieniu – nie składaj dokumentu potwierdzającego niepełnosprawność.W miesiącu poprzedzającym datę upublicznienia ogłoszenia wskaźnik zatrudnienia osób niepełnosprawnych w urzędzie, w rozumieniu przepisów ustawy o rehabilitacji zawodowej i społecznej oraz zatrudnianiu osób niepełnosprawnych, wyniósł co najmniej 6%Warunki pracyWarunki dotyczące charakteru pracy na stanowisku i sposobu wykonywania zadań:praca administracyjno-biurowa,zagrożenie korupcją,przeprowadzanie kontroli w innych urzędach.Miejsce i otoczenie organizacyjno-techniczne stanowiska pracy:stanowisko pracy zlokalizowane w siedzibie urzędu,pokój biurowy mieści się na czwartym piętrze wielokondygnacyjnego budynku, wejście główne do budynku jest wyposażone w podjazd dla osób niepełnosprawnych,na stanowisku pracy nie występują czynniki szkodliwe dla zdrowia,większość czynności jest wykonywana w pozycji siedzącej,praca przy monitorze powyżej 4 godzin dziennie, przy naturalnym i sztucznym oświetleniu,podstawowe wyposażenie na stanowisku to: komputer, telefon, drukarka.Dodatkowe informacjeJeśli zostaniesz zakwalifikowany do kolejnego etapu, powiadomimy Cię o tym mailowo (lub telefonicznie – jeżeli nie podałeś adresu e-mail). Tak samo zrobimy, jeśli nie uda Ci się przejść do dalszego etapu.Oświadczenia podpisz odręcznie i wstaw datę ich sporządzenia.Oferty kandydatów, którzy nie zostali zatrudnieni, zniszczymy po 3 miesiącach od zakończenia naboru. Do tego czasu będzie można je odebrać w urzędzie (ale nie odeślemy ich).Nie rozpatrzymy oferty, którą nadałeś po terminie. Dotyczy to też uzupełniania ofert.Kompletna aplikacja to taka, która zawiera wszystkie wymagane dokumenty i własnoręcznie podpisane oświadczenia.Do dokumentów sporządzonych w języku obcym dołącz kopie ich tłumaczenia na język polski sporządzone przez tłumacza przysięgłego.Nie przesyłaj wszystkich dokumentów, które uznasz, że mogą Ci pomóc w naborze. Prześlij tylko te, których wymagamy lub zalecamy.Zwróć uwagę na warunki pracy, które wskazaliśmy w ogłoszeniu – rzetelnie oceń, czy odpowiada Ci taka praca.Złożone przez Ciebie dokumenty zweryfikujemy pod względem formalnym na podstawie zapisów ogłoszenia dotyczących wymaganych i dodatkowych dokumentów.Informacje o etapach naboru dostępne są na stronie BIP Pomorskiego Urzędu Wojewódzkiego w GdańskuInformacje na temat procedury zgłoszeń wewnętrznych znajdują się na stronie: https://www.gov.pl/web/uw-pomorski/zglaszanie-naruszenPlanujemy następujące metody/techniki naboru:weryfikacja formalna nadesłanych ofert,test wiedzy (opcjonalnie),sprawdzian praktyczny (opcjonalnie),rozmowa kwalifikacyjna.Twoja aplikacja musi zawierać (dokumenty niezbędne)CV i list motywacyjnyKopie dokumentów potwierdzających spełnienie wymagania niezbędnego w zakresie wykształceniaOświadczenie, że w okresie od dnia 22 lipca 1944 r. do dnia 31 lipca 1990 r. kandydatka/kandydat nie pracowała/ł, nie pełniła/ł służby w organach bezpieczeństwa państwa i nie była/był współpracownikiem tych organów w rozumieniu przepisów ustawy z dnia 18 października 2006 r. o ujawnianiu informacji o dokumentach organów bezpieczeństwa państwa z lat 1944–1990 oraz treści tych dokumentów. Nie dotyczy kandydatek/kandydatów urodzonych 1 sierpnia 1972 r. lub późniejOświadczenie o posiadaniu obywatelstwa polskiegoOświadczenie o korzystaniu z pełni praw publicznychOświadczenie o nieskazaniu prawomocnym wyrokiem za umyślne przestępstwo lub umyślne przestępstwo skarboweDołącz, jeśli posiadasz (dokumenty dodatkowe)Kopie dokumentów potwierdzających spełnienie wymagania dodatkowego w zakresie wykształceniaKopie dokumentów potwierdzających spełnienie wymagania dodatkowego w zakresie doświadczenia zawodowego / stażu pracyW przypadku przekazania dokumentu potwierdzającego niepełnosprawność konieczne jest dołączenie oświadczenia o wyrażeniu zgody na przetwarzanie danych osobowych do celów naboru w zakresie wykraczającym poza katalog danych określonych w Kodeksie pracy oraz wynikających z ustawy o służbie cywilnej.Aplikuj do: 27 maja 2025W formie papierowej z dopiskiem:""ogłoszenie nr 151973 ""na adres:Pomorski Urząd Wojewódzki w GdańskuPunkt przyjęć korespondencji w pokoju 24 w kancelarii ogólnej przy wejściu „A""ul. Okopowa 21/2780-810 GdańskNa kopercie i liście motywacyjnym należy umieścić dopisek: 69/25Dokumenty można składać elektronicznie tylko przez elektroniczną skrzynkę podawczą (ESP) utworzoną na elektronicznej Platformie Usług Administracji Publicznej (ePUAP) oraz za pomocą e-doręczeń (adres:AE:PL-69276-68927-JEAHF).Informacje dot. doręczania dokumentów elektronicznych znajdziesz nastronie BIP urzędu w zakładce Kontakt -> Elektroniczna Skrzynka Podawcza/ eDoręczeniaZapraszamy również do kontaktu telefonicznego:(58) 30 77 141, (58) 30 77 530.Więcej o pracy na stronie urzędu:https://www.gov.pl/web/uw-pomorski/pracaDokumenty należy złożyć do:27.05.2025Decyduje data:stempla pocztowego / osobistego dostarczenia oferty do urzęduAplikując, oświadczasz, że znana Ci jest treść informacji na temat przetwarzania danych osobowych w naborzePrzetwarzanie danych osobowychDANE OSOBOWE - KLAUZULA INFORMACYJNAPrzed przystąpieniem do procesu naboru proszę zapoznać się z klauzulą informacyjną dot. przetwarzania danych osobowych https://www.gov.pl/web/uw-pomorski/jak-zlozyc-dokumenty2",2025-05-25 16:35:46,2025-05-25 16:35:59.297
Operator CNC Frezarki,Gdańsk MłyniskaNa Ostrowiu 15-20,https://ogloszenia.trojmiasto.pl/praca-zatrudnie/operator-cnc-frezarki-ogl66089348.html,,20.05.2025,,Stacjonarna,Umowa o pracę,Pełny etat,Praca w Polsce,"Specjalista,, Pracownik fizyczny",,"Obowiązki:Przygotowanie, ustawienie i uruchamianie maszyny, zgodnie z procedurami operacyjnymi.Interpretowanie rysunków technicznych i wykonywanie ukosowania.Zbieranie danych i rejestrowanie ich w planie produkcji oraz w systemie SAP, aby zapewnić śledzenie procesu.Używanie urządzeń pomiarowych i taśmy mierniczej do każdego wymiaru blachy, aby uzyskać precyzję w operacjach.Transportowanie arkuszy blach za pomocą suwnicy.Używanie szlifierki do czyszczenia ukosu, jeśli to konieczne.Zapewnianie jakości przetworzonych produktów zgodnie ze standardami kontroli.Optymalizowanie dostępnych środków i narzędzi.Informowanie przełożonych o awariach maszyny lub problemach w procesie produkcyjnym oraz współpraca z technikami utrzymania ruchu w celu ich usunięcia.Unikanie niepotrzebnych przestojów w procesie.Wykonywanie innych zadań zgodnych z wymaganiami związanymi z pełnioną funkcją.Przestrzeganie norm bezpieczeństwa i używanie środków ochrony osobistej.Uczestnictwo w programach szkoleniowych, gdy zostanie to zlecone.Wymagania:Min. 6 miesięcy doświadczenia w obsłudze maszyn takich jak wytaczarka, frezarka lub tokarka.Wykształcenie średnie techniczne lub zawodowe.Potwierdzone certyfikatem ukończenie kursu obsługi maszyn CNC.Uprawnienia UDT do obsługi suwnic z poziomu roboczego.Umiejętność czytania i interpretacji rysunków technicznych oraz dokumentacji produkcyjnej.Umiejętność posługiwania się urządzeniami pomiarowymi.Zdolność efektywnej współpracy z innymi pracownikami działu produkcji.Umiejętności interpersonalne, elastyczność, inicjatywa, organizacja, zaangażowanie.Oferujemy:Stałe wynagrodzenie + premię miesięczną;Prywatną opiekę medyczną, grupowe ubezpieczenie na życie opłacane przez pracodawcę;Dofinansowanie do karty Multisport;Program poleceń pracowniczych;Możliwość rozwoju zawodowego poprzez szkolenia w ramach obszaru produkcyjnego;Praca w fabryce w centrum Gdańska.Zastrzegamy sobie prawo do kontaktu z wybranymi kandydatami/kami.",2025-05-25 16:35:46,2025-05-25 16:35:59.298
Metalizer,Gdańsk MłyniskaNa Ostrowiu 15-20,https://ogloszenia.trojmiasto.pl/praca-zatrudnie/metalizer-ogl66041261.html,,03.04.2025,24.04.2025,Stacjonarna,Umowa o pracę,Pełny etat,Produkcja,Pracownik fizyczny,,"Obowiązki:Przygotowanie i weryfikacja funkcjonalności sprzętu do metalizacji;Ustawianie parametrów procesu oraz uruchamianie maszyn do metalizacji;Nakładanie powłok metalicznych na elementy zgodnie z normami i wymaganiami jakościowymi;Monitorowanie pracy maszyn i kontrola parametrów technicznych;Sprawdzanie powierzchni po procesie metalizacji i analiza jakości wykonanych prac;Wykonywanie pomiarów w celu zapewnienia zgodności z wymaganiami technicznymi;Transport konstrukcji stalowych przy użyciu suwnicy;Dbanie o sprawność techniczną urządzeń i zgłaszanie potrzeby wymiany części eksploatacyjnych.Wymagania:Minimum 6 miesięcy doświadczenia w pracy z procesami metalizacji;Znajomość obsługi urządzeń do metalizacji oraz śrutownic;Uprawnienia do obsługi suwnic (IS);Umiejętność pracy zespołowej, elastyczność i zaangażowanie;Gotowość do pracy w systemie zmianowym.Oferujemy:Stałe wynagrodzenie + premię miesięczną;Prywatną opiekę medyczną, grupowe ubezpieczenie na życie opłacane przez pracodawcę;Dofinansowanie do karty Multisport;Program poleceń pracowniczych;Możliwość rozwoju zawodowego poprzez szkolenia w ramach obszaru produkcyjnego;Praca w fabryce w centrum Gdańska.",2025-05-25 16:35:46,2025-05-25 16:35:59.299
Operator/Operatorka Komory Śrutowniczej,Gdańsk MłyniskaNa Ostrowiu 15-20,https://ogloszenia.trojmiasto.pl/praca-zatrudnie/operatoroperatorka-komory-srutowniczej-ogl66041273.html,,03.04.2025,15.05.2025,Stacjonarna,Umowa o pracę,Pełny etat,Produkcja,Pracownik fizyczny,,"Obowiązki:Przygotowanie sprzętu do procesu śrutowania oraz weryfikacja jego funkcjonalności;Przygotowywanie detali i komponentów do procesu śrutowania;Monitorowanie pracy maszyn, kontrola parametrów technicznych;Analizowanie efektów śrutowania pod kątem jakości i zgodności z wymaganiami technicznymi;Wykonywanie wymaganych pomiarów w celu zapewnienia jakości procesu;Raportowanie o przebiegu pracy maszyn oraz o ewentualnych problemach technicznych.Wymagania:Minimum 6 miesięcy doświadczenia w obsłudze śrutownic;Znajomość obsługi maszyn do obróbki strumieniowo-ściernej (za pomocą dyszy ciśnieniowej);Uprawnienia do obsługi suwnic (IS);Zdolności organizacyjne, elastyczność i zaangażowanie;Gotowość do pracy w systemie zmianowym.Oferujemy:Stałe wynagrodzenie + premię miesięczną;Prywatną opiekę medyczną, grupowe ubezpieczenie na życie opłacane przez pracodawcę;Dofinansowanie do karty Multisport;Program poleceń pracowniczych;Możliwość rozwoju zawodowego poprzez szkolenia w ramach obszaru produkcyjnego;Praca w fabryce w centrum Gdańska.",2025-05-25 16:35:47,2025-05-25 16:35:59.299
Osoby do sprzątania klatek pielęgnacji terenów zielonych,Gdańsk Zaspa,https://ogloszenia.trojmiasto.pl/praca-zatrudnie/osoby-do-sprzatania-klatek-pielegnacji-terenow-zielonych-ogl65843940.html,,19.09.2024,22.05.2025,Praca w terenie,Umowa zlecenie,Część etatu,Utrzymanie czystości,Pracownik fizyczny,,"Firma Ecoclean zatrudni osoby do sprzątania klatek, terenu przyległego do nieruchomości oraz pielęgnacji zieleni (odchwaszczanie, pielenie, grabienie liści, itp.) Praca całoroczna od poniedziałku do piątku w niepełnym wymiarze godzinowym, (ok. 5 godz. dziennie). Wynagrodzenie od 2300zł na rękę + premia uznaniowa.Miejsce pracy Gdańsk Zaspa",2025-05-25 16:35:47,2025-05-25 16:35:59.300
Zastępca kierownika / Doradca klienta | Ekskluzywne wyposażenie wnętrz,Gdynia Orłowoal. Zwycięstwa 256,https://ogloszenia.trojmiasto.pl/praca-zatrudnie/zastepca-kierownika-doradca-klienta-ekskluzywne-wyposazenie-wnetrz-ogl65992300.html,,17.02.2025,19.05.2025,Stacjonarna,"Umowa o pracę,, Umowa zlecenie","Pełny etat,, Część etatu","Architektura i projektowanie,, Obsługa klienta,, Sprzedaż detaliczna",Specjalista,,"Zastępca kierownika | Doradca Klienta PremiumMiejsce pracy:Showroom SPENSEN HOME – Galeria KLIF GdyniaBranża:Wyposażenie wnętrz | Meble | Oświetlenie | DekoracjeKochasz design i luksusowe wnętrza? Dołącz do SPENSEN HOME!SPENSEN HOME COLLECTION to showroom oferujący ekskluzywne marki wyposażenia wnętrz premium. W naszym asortymencie znajdzieszmeble, oświetlenie, dekoracje i prezentyod topowych światowych brandów, takich jakEICHHOLTZ, ALESSI, MISSONI HOME, LALIQUEi wiele innych. Naszą misją jest nie tylko sprzedaż, ale takżedoradztwo i stylizacja wnętrz– pomagamy klientom tworzyć eleganckie i niepowtarzalne przestrzenie.Szukamy osoby pełnej pasji do designu, która chce dołączyć do naszego zespołu i wspólnie z nami inspirować klientów!OPIS STANOWISKAprofesjonalna i kompleksowa obsługa klienta premium – pomagaj im w wyborze idealnych produktów,aktywne pozyskiwanie klienta i budowanie długoterminowych relacji,profesjonalne doradztwo w zakresie doboru artykułów wyposażenia wnętrz,realizacja celów sprzedażowych i przygotowywanie ofert produktowych,dbanie o rozwój marki i kreowanie jej prestiżowego wizerunku.współpraca z architektami i stylistami wnętrz.wsparcie kierownika showroomu w codziennym zarządzaniu zespołem, ekspozycją i standardami obsługi klienta, a w razie jego nieobecności – pełnienie funkcji osoby odpowiedzialnej za organizację pracy showroomu.WYMAGANIA:doświadczenie w bezpośredniej sprzedaży i obsłudze klienta premium w branży wyposażenia wnętrz mile widziane,wysokie poczucie estetyki, zainteresowanie designem i tematyką wnętrzarską,samodzielność, kreatywność i zaangażowanie w wykonywane zadania,dyspozycyjność do zmianowej pracy stacjonarnej od poniedziałku do soboty,umiejętność szybkiego uczenia się i radzenia sobie w sytuacjach trudnych,wysoka kultura osobista, umiejętność zarządzania własnym wizerunkiem oraz nienaganna prezencja,komunikatywna znajomość języka angielskiego.OFERUJEMY:zatrudnienie na podstawie umowy o pracę lub umowy zleceniawynagrodzenie tak atrakcyjne jak Twoje zaangażowanie,wynagrodzenie podstawowe i premie wynikające ze zrealizowanych celów,pracę w przyjaznej atmosferze i otoczeniu pięknych produktów,współpracę ze znanymi światowymi markami z branży wyposażenia wnętrz,możliwość rozwoju przez udział w szkoleniach i targach w kraju i za granicą.",2025-05-25 16:35:48,2025-05-25 16:35:59.301
Księgowa / Księgowy,Kiełpino k. KartuzŚwierkowa 26,https://ogloszenia.trojmiasto.pl/praca-zatrudnie/ksiegowa-ksiegowy-ogl65995656.html,,20.02.2025,15.04.2025,Stacjonarna,Umowa o pracę,Pełny etat,Księgowość,"Specjalista,, Pracownik biurowy",,"Dołącz do naszego zespołu jako Księgowy/a i rozpocznij pracę w prężnie rozwijającej się firmie o ugruntowanej pozycji na rynku!Wymagania:- wykształcenie minimum średnie – w obszarze rachunkowości lub finansów- mile widziane doświadczenie na stanowisku samodzielnego księgowego- znajomość rachunkowości, oraz przepisów prawa podatkowego VAT, CIT i PIT- dobra znajomość MS Office- znajomość programów Symfonia, Optima- bardzo dobra organizacja pracy- samodzielność, odpowiedzialność, sumiennośćZakres obowiązków:- księgowanie dokumentów kosztowych, wyciągów bankowych- rozliczenie sprzedaży- fakturowanie wybranych transakcji sprzedaży- uzgadnianie sald kont księgi głównej- sporządzanie rocznych i okresowych sprawozdań finansowych- sporządzanie deklaracji podatkowych (CIT, VAT, podatki lokalne),- prowadzenie ewidencji podatkowych, wymaganych rejestrów i dokumentów do celów podatkowych- sporządzanie wewnętrznych raportów na potrzeby Zarządu- wspieranie procesu kontroli kosztów działalności firmy, optymalizacja procesów i kontrola opłacalności- współpraca z zewnętrznymi podmiotami (w tym: z audytorami, organami podatkowymi i bankami);Oferujemy:- stabilne zatrudnienie na podstawie umowy o pracę w firmie o ugruntowanej pozycji na rynku- atrakcyjne wynagrodzenie- wsparcie głównego Księgowego- potrzebne narzędzia pracyCV prosimy przesyłać na adresp...@szymi...Wyświetl e-mail×Zabezpieczenie anty-spamoweZamknij",2025-05-25 16:35:48,2025-05-25 16:35:59.301
Kierownik Budowy,Pruszcz Gdański,https://ogloszenia.trojmiasto.pl/praca-zatrudnie/kierownik-budowy-ogl63857476.html,,27.10.2020,22.03.2025,Stacjonarna,Umowa o pracę,Pełny etat,Budownictwo,"Kierownik,, Specjalista",,"Przedsiębiorstwo Budowlane SZYMICHOWSKI Sp. z o.o.poszukuje pracownika  na stanowiskoKierownik BudowyZakres obowiązków:Kierowanie zespołem pracowników, delegowanie zadań,Nadzór oraz koordynacja prac wykonywanych na budowie,Realizacja zadań zgodnie z przekazaną dokumentacją wykonawczą,Przyjmowanie oraz kontrolowanie dostawy materiałów na teren budowy,Nadzór nad przestrzeganiem przepisów w zakresie BHP,Przekazywanie dokumentacji do biura,Nadzór nad powierzonym sprzętem.Wymagania:Umiejętność czytania i analizy dokumentacji projektowej;Podstawowa znajomość przepisów związanych z procesem budowlanym;Doświadczenie w pracy na budowie będzie dodatkowym atutem,Wysokie zdolności organizacyjne i umiejętność pracy w zespole,Znajomość zasad BHP i przepisów prawa budowlanego,Uprawnienia Kierownika BudowyOferujemy:Możliwość rozwoju zawodowego,Długofalową współpracę w strukturach firmy.",2025-05-25 16:35:49,2025-05-25 16:35:59.302
Pracownik ogólnobudowlany,Pruszcz GdańskiArctowskiego,https://ogloszenia.trojmiasto.pl/praca-zatrudnie/pracownik-ogolnobudowlany-ogl65733504.html,,08.06.2024,28.04.2025,"Stacjonarna,, Praca w terenie","Umowa o pracę,, Umowa zlecenie",Pełny etat,"Budownictwo,, Wykonawcy budowlani",Pracownik fizyczny,,"Aktualnie poszukujemy pracowników ogólnobudowlanych(cudzoziemcy mile widziani), w szczególności:murarzy,cieśli szalunkowych,zbrojarzyZakres obowiązków:Wykonywanie różnorodnych prac ogólnobudowlanych, w tym:wykonywanie prac murarskichwykonywanie prac ciesielskichwykonywanie prac wykończeniowychWymagania:Wysoka kultura osobistai komunikatywność,Umiejętność pracy w zespole,Sprawność fizycznej idobry stan zdrowia,Komunikatywność, zaradność,Samodyscyplina,Chęci do pracy, nauki i rozwoju,Umiejętność obsługi elektronarzędzi,Doświadczenie przy wykonywaniu prac ogólnobudowlanych mile widziane.Oferujemy:Realizację zróżnicowanych zadańWsparcie ze strony osób współpracujących i kadry zarządzającejNiezbędne narzędzia do wykonywania pracyAtrakcyjne wynagrodzenieStałe zatrudnienieZachęcamy do kontaktu telefonicznego (pn-pt 08:00 - 16:00) jak i mailowego.Miejsce pracy: Pruszcz Gdański / Straszyn",2025-05-25 16:35:50,2025-05-25 16:35:59.302
Pracownik ogólnobudowlany,StraszynBoczna,https://ogloszenia.trojmiasto.pl/praca-zatrudnie/pracownik-ogolnobudowlany-ogl65733506.html,,08.06.2024,28.04.2025,"Stacjonarna,, Praca w terenie","Umowa o pracę,, Umowa zlecenie",Pełny etat,"Budownictwo,, Wykonawcy budowlani",Pracownik fizyczny,,"Aktualnie poszukujemy pracowników ogólnobudowlanych(cudzoziemcy mile widziani), w szczególności:murarzy,cieśli szalunkowych,zbrojarzyZakres obowiązków:Wykonywanie różnorodnych prac ogólnobudowlanych, w tym:wykonywanie prac murarskichwykonywanie prac ciesielskichwykonywanie prac wykończeniowychWymagania:Wysoka kultura osobistai komunikatywność,Umiejętność pracy w zespole,Sprawność fizycznej idobry stan zdrowia,Komunikatywność, zaradność,Samodyscyplina,Chęci do pracy, nauki i rozwoju,Umiejętność obsługi elektronarzędzi,Doświadczenie przy wykonywaniu prac ogólnobudowlanych mile widziane.Oferujemy:Realizację zróżnicowanych zadańWsparcie ze strony osób współpracujących i kadry zarządzającejNiezbędne narzędzia do wykonywania pracyAtrakcyjne wynagrodzenieStałe zatrudnienieZachęcamy do kontaktu telefonicznego (pn-pt 08:00 - 16:00) jak i mailowego.Miejsce pracy: Pruszcz Gdański / Straszyn",2025-05-25 16:35:50,2025-05-25 16:35:59.303
