title,location,url,salary,date_posted,date_updated,work_mode,contract_type,work_time,industry,position_level,experience_required,description,scraped_date,saved_to_db
"Zastępca Kierownika Oddziału, Dyspozytornia Medyczna w Gdańsku",Gdańsk ŚródmieścieOkopowa 21/27,https://ogloszenia.trojmiasto.pl/praca-zatrudnie/zastepca-kierownika-oddzialu-dyspozytornia-medyczna-w-gdansku-ogl66088196.html,,19.05.2025,19.05.2025,Stacjonarna,Umowa o pracę,Pełny etat,Zarządzanie biurem,Specjalista,,"Pomorski Urząd Wojewódzki w Gdańsku80-810 Gdańsk Okopowa 21/27Ogłoszenie nr 152006 / 17.05.2025Zastępca Kierownika Oddziału do spraw: kierowania i organizacji pracy dyspozytorni medycznej w Wydziale Państwowego Ratownictwa Medycznego, Oddział Dyspozytornia Medyczna w Gdańsku#administracja publicznaLiczba stanowisk: 1Wymiar etatu: 1Status: nabór w tokuMiejsce pracy: ul. Okopowa 21/27Ważne do: 27.05.2025Wynagrodzenie zasadnicze: 10500,00 złCzym będziesz się zajmowaćOsoba na tym stanowisku:Wspiera kierownika w organizowaniu i kierowaniu pracą dyspozytorni medycznej, w tym w opracowaniu szczegółowego sposobu funkcjonowania dyspozytorni medycznej, zapewnieniu ciągłości jej funkcjonowania oraz organizacji pracy dyspozytorów medycznychNadzoruje pracę dyspozytorów medycznych, ze szczególnym uwzględnieniem sposobu przeprowadzania rozmów, decyzji podejmowanych w zakresie dysponowania oraz odmów zadysponowania zespołów ratownictwa medycznego, obsługi zdarzeń, w tym zdarzeń z dużą liczbą poszkodowanychPrzygotowuje, weryfikuje i aktualizuje wykazy oraz opracowania niezbędne podczas realizacji zadań przez dyspozytorów medycznychDokonuje oceny sposobu realizacji zadań przez dyspozytorów medycznych na podstawie formularza oceny pracy dyspozytora medycznego, uwzględniającego kryteria oceny pracy dyspozytora medycznegoUczestniczy w opracowaniu i aktualizowaniu planu postępowania w przypadku wystąpienia awarii uniemożliwiającej przyjmowanie i obsługę powiadomień o zdarzeniach i zgłoszeniach alarmowychSporządza analizy liczby, natężenia i czasu obsługi zgłoszeń na stanowisku dyspozytorów medycznychRozpatruje zażalenia, skargi i wnioski dotyczące funkcjonowania dyspozytorni medycznejKogo poszukujemyPotrzebne ci będą(wymagania niezbędne)Wykształcenie: wyższe co najmniej studia pierwszego stopnia na kierunku pielęgniarstwo lub co najmniej tytuł zawodowy licencjata wymagany dla ratownika medycznego.Doświadczenie zawodowe co najmniej 2 lata w zakresie realizacji zadań na stanowisku dyspozytora medycznegoW przypadku studiów pierwszego stopnia na kierunku pielęgniarstwo niezbędne jest posiadanie kwalifikacji wymaganych dla pielęgniarki systemuZnajomość ustaw: o Państwowym Ratownictwie Medycznym, o prawach pacjenta i Rzeczniku Praw Pacjenta, o ochronie danych osobowych, o służbie cywilnej, o wojewodzie i administracji rządowej w województwieW służbie cywilnej nie może być zatrudniona osoba, która w okresie od dnia 22 lipca 1944 r. do dnia 31 lipca 1990 r. pracowała lub pełniła służbę w organach bezpieczeństwa państwa lub była współpracownikiem tych organów w rozumieniu przepisów ustawy z dnia 18 października 2006 r. o ujawnianiu informacji o dokumentach organów bezpieczeństwa państwa z lat 1944–1990 oraz treści tych dokumentów - nie dotyczy kandydatek/kandydatów urodzonych 1 sierpnia 1972 r. lub później. Osoba wybrana do zatrudnienia będzie musiała złożyć oświadczenie lustracyjne, jeśli urodziła się przed 1 sierpnia 1972 r.Posiadanie obywatelstwa polskiegoKorzystanie z pełni praw publicznychNieskazanie prawomocnym wyrokiem za umyślne przestępstwo lub umyślne przestępstwo skarboweDodatkowym atutem będzie (wymagania dodatkowe)Znajomość rozporządzeń Ministra Zdrowia: w sprawie rodzajów dokumentacji dyspozytorni medycznej, w sprawie szczegółowego zakresu zadań psychologa w ramach wsparcia psychologicznego dyspozytorów medycznych, w sprawie organizacji dyspozytorni medycznej, w sprawie ramowych procedur obsługi zgłoszeń alarmowych i powiadomień o zdarzeniach przez dyspozytora medycznego, w sprawie Systemu Wspomagania Dowodzenia Państwowego Ratownictwa MedycznegoZnajomość obwieszczenia Ministra Zdrowia w sprawie algorytmu zbierania wywiadu medycznego przez dyspozytora medycznegoCo oferujemyMożliwość wyjścia w celu załatwienia ważnej sprawyKarty sportowe lub dofinansowanie zajęć sportowo-rekreacyjnychDopłata do biletów na imprezy kulturalnePomieszczenie lub stojaki na rowery na terenie urzęduDofinansowanie do wypoczynku pracownikówDofinansowanie do wypoczynku dzieci pracownikówDodatek za wysługę lat od 5% do 20% wynagrodzenia zasadniczego, w zależności od udokumentowanego stażu pracyMożliwość dofinansowania do legitymacji ze zniżką 50% na przejazdy PKP, SKM, PKM po przepracowaniu co najmniej 6 miesięcyDodatkowe wynagrodzenie roczne tzw. ""trzynastka""Wsparcie psychologiczneDostępnośćNasz urząd jest pracodawcą równych szans. Aplikacje rozważane są z równą uwagą bez względu na płeć, wiek, niepełnosprawność, rasę, narodowość, przekonania polityczne, przynależność związkową, pochodzenie etniczne, wyznanie, orientację seksualną czy też jakąkolwiek inną cechę prawnie chronioną.Jako osoba z niepełnosprawnością nie możesz skorzystać z pierwszeństwa w zatrudnieniu – nie składaj dokumentu potwierdzającego niepełnosprawność.W miesiącu poprzedzającym datę upublicznienia ogłoszenia wskaźnik zatrudnienia osób niepełnosprawnych w urzędzie, w rozumieniu przepisów ustawy o rehabilitacji zawodowej i społecznej oraz zatrudnianiu osób niepełnosprawnych, wyniósł co najmniej 6%Warunki pracyWarunki dotyczące charakteru pracy na stanowisku i sposobu wykonywania zadań:praca administracyjno-biurowa,praca pod presją czasu w sytuacjach stresowych.Miejsce i otoczenie organizacyjno-techniczne stanowiska pracy:na stanowisku pracy nie występują czynniki szkodliwe dla zdrowia,pokój biurowy mieści się na parterze wielokondygnacyjnego budynku,większość czynności jest wykonywana w pozycji siedzącej,praca przy monitorze powyżej 4 godzin dziennie, przy naturalnym i sztucznym oświetleniu,podstawowe wyposażenie na stanowisku to: komputer, telefon, drukarka.Dodatkowe informacjeJeśli zostaniesz zakwalifikowany do kolejnego etapu, powiadomimy Cię o tym mailowo (lub telefonicznie – jeżeli nie podałeś adresu e-mail). Tak samo zrobimy, jeśli nie uda Ci się przejść do dalszego etapu.Oświadczenia podpisz odręcznie i wstaw datę ich sporządzenia.Oferty kandydatów, którzy nie zostali zatrudnieni, zniszczymy po 3 miesiącach od zakończenia naboru. Do tego czasu będzie można je odebrać w urzędzie (ale nie odeślemy ich).Nie rozpatrzymy oferty, którą nadałeś po terminie. Dotyczy to też uzupełniania ofert.Kompletna aplikacja to taka, która zawiera wszystkie wymagane dokumenty i własnoręcznie podpisane oświadczenia.Do dokumentów sporządzonych w języku obcym dołącz kopie ich tłumaczenia na język polski sporządzone przez tłumacza przysięgłego.Nie przesyłaj wszystkich dokumentów, które uznasz, że mogą Ci pomóc w naborze. Prześlij tylko te, których wymagamy lub zalecamy.Zwróć uwagę na warunki pracy, które wskazaliśmy w ogłoszeniu – rzetelnie oceń, czy odpowiada Ci taka praca.Złożone przez Ciebie dokumenty zweryfikujemy pod względem formalnym na podstawie zapisów ogłoszenia dotyczących wymaganych i dodatkowych dokumentów.Informacje o etapach naboru dostępne są na stronie BIP Pomorskiego Urzędu Wojewódzkiego w GdańskuInformacje na temat procedury zgłoszeń wewnętrznych znajdują się na stronie: https://www.gov.pl/web/uw-pomorski/zglaszanie-naruszenPlanujemy następujące metody/techniki naboru:weryfikacja formalna nadesłanych ofert,test wiedzy (opcjonalnie),sprawdzian praktyczny (opcjonalnie),badanie kompetencji kierowniczych,rozmowa kwalifikacyjna.Twoja aplikacja musi zawierać (dokumenty niezbędne)CV i list motywacyjnyKopie dokumentów potwierdzających spełnienie wymagania niezbędnego w zakresie wykształceniaKopie dokumentów potwierdzających spełnienie wymagania niezbędnego w zakresie doświadczenia zawodowego / stażu pracyKopie dokumentów potwierdzających spełnienie wymagania niezbędnego w zakresie kwalifikacji wymaganych dla pielęgniarki systemu, w przypadku ukończenia studiów pierwszego stopnia na kierunku pielęgniarstwoOświadczenie, że w okresie od dnia 22 lipca 1944 r. do dnia 31 lipca 1990 r. kandydatka/kandydat nie pracowała/ł, nie pełniła/ł służby w organach bezpieczeństwa państwa i nie była/był współpracownikiem tych organów w rozumieniu przepisów ustawy z dnia 18 października 2006 r. o ujawnianiu informacji o dokumentach organów bezpieczeństwa państwa z lat 1944–1990 oraz treści tych dokumentów. Nie dotyczy kandydatek/kandydatów urodzonych 1 sierpnia 1972 r. lub późniejOświadczenie o posiadaniu obywatelstwa polskiegoOświadczenie o korzystaniu z pełni praw publicznychOświadczenie o nieskazaniu prawomocnym wyrokiem za umyślne przestępstwo lub umyślne przestępstwo skarboweDołącz, jeśli posiadasz (dokumenty dodatkowe)W przypadku przekazania dokumentu potwierdzającego niepełnosprawność konieczne jest dołączenie oświadczenia o wyrażeniu zgody na przetwarzanie danych osobowych do celów naboru w zakresie wykraczającym poza katalog danych określonych w Kodeksie pracy oraz wynikających z ustawy o służbie cywilnej.Aplikuj do: 27 maja 2025W formie papierowej z dopiskiem:""ogłoszenie nr 152006 ""na adres:Pomorski Urząd Wojewódzki w GdańskuPunkt przyjęć korespondencji w pokoju 24 w kancelarii ogólnej przy wejściu „A""ul. Okopowa 21/2780-810 GdańskNa kopercie i liście motywacyjnym należy umieścić dopisek: 70/25Dokumenty można składać elektronicznie tylko przez elektroniczną skrzynkę podawczą (ESP) utworzoną na elektronicznej Platformie Usług Administracji Publicznej (ePUAP) oraz za pomocą e-doręczeń (adres:AE:PL-69276-68927-JEAHF).Informacje dot. doręczania dokumentów elektronicznych znajdziesz nastronie BIP urzędu w zakładce Kontakt -> Elektroniczna Skrzynka Podawcza/ eDoręczeniaZapraszamy również do kontaktu telefonicznego:(58) 30 77 141, (58) 30 77 530.Więcej o pracy na stronie urzędu:https://www.gov.pl/web/uw-pomorski/pracaDokumenty należy złożyć do:27.05.2025Decyduje data:stempla pocztowego / osobistego dostarczenia oferty do urzęduAplikując, oświadczasz, że znana Ci jest treść informacji na temat przetwarzania danych osobowych w naborzePrzetwarzanie danych osobowychDANE OSOBOWE - KLAUZULA INFORMACYJNAPrzed przystąpieniem do procesu naboru proszę zapoznać się z klauzulą informacyjną dot. przetwarzania danych osobowych https://www.gov.pl/web/uw-pomorski/jak-zlozyc-dokumenty2",2025-05-25 16:35:43,2025-05-25 16:35:59.293
Konsultant/ka Infolinii Przychodzącej  Vectra,Gdynia Orłowoal. Zwycięstwa 253,https://ogloszenia.trojmiasto.pl/praca-zatrudnie/konsultantka-infolinii-przychodzacej-vectra-ogl66090043.html,,20.05.2025,,Stacjonarna,Umowa zlecenie,"Pełny etat,, Część etatu",Call center,"Specjalista,, Pracownik biurowy",,"Konsultant/ka Infolinii Przychodzącej – VectraDołącz do zespołu Vectry w Gdyni (Redłowo) i pracuj w miejscu, gdzie łączyszpomaganie z doradzaniem i sprzedażą.Co będziesz robić?Odbierać połączenia od osób, które same kontaktują się z nami – zarówno obecnych klientów, jak i tych, którzy dopiero rozważają nasze usługiSprzedawać – doradzać, prezentować oferty i finalizować zamówieniaRozmawiać z klientem w sposób, który buduje zaufanie i daje poczucie profesjonalnej obsługiWprowadzać dane do systemu sprzedażowego i przygotowywać zamówieniaDbać o pozytywny przebieg rozmowy – zależy nam na jakościCo oferujemy?Stabilne wynagrodzenie + premie sprzedażowe– masz realny wpływ na swoje zarobkiPełne wdrożenie i szkolenie – bez stresu, wszystko tłumaczymy krok po krokuŚcieżkę rozwoju – od konsultanta po specjalistę lub treneraZgraną i wspierającą ekipę – nie jesteś zostawiony/a sam/aPakiet benefitów:Karta MultiSport z dofinansowaniemZniżki na usługi Vectry – Klub VectraUbezpieczenie grupowe na życie (Ergo Hestia)MediPakiet – prywatna opieka medycznaProgram poleceń – zaproś znajomych do pracy i zyskajZniżki na studia w WSB MeritoZakupy sprzętu LG i PHILIPS w niższych cenachUbezpieczenie turystyczne AXACzego od Ciebie oczekujemy?Otwartości na rozmowy i chęci do sprzedaży – to główne zadanie na tym stanowiskuUmiejętności słuchania i budowania relacji – ważna jest jakośćPodstawowej obsługi komputera (reszty Cię nauczymy)Gotowości do pracystacjonarnej w Gdyni – RedłowoDyspozycyjności do pracy wsystemie zmianowym (7:00–22:00)orazdwóch sobót w miesiącu",2025-05-25 16:35:44,2025-05-25 16:35:59.294
Inspektor wojewódzki w Wydziale Polityki Społecznej,Gdańsk ŚródmieścieOkopowa 21/27,https://ogloszenia.trojmiasto.pl/praca-zatrudnie/inspektor-wojewodzki-w-wydziale-polityki-spolecznej-ogl66085849.html,,16.05.2025,16.05.2025,Stacjonarna,Umowa o pracę,Pełny etat,"Wsparcie administracyjne,, Doradztwo i consulting",Specjalista,,"Pomorski Urząd Wojewódzki w Gdańsku80-810 Gdańsk Okopowa 21/27Ogłoszenie nr 151960 / 16.05.2025Inspektor WojewódzkiDo spraw: nadzoru działań w zakresie systemu oparcia społecznego w Wydziale Polityki Społecznej, Odział Nadzoru i Kontroli#administracja publicznaLiczba stanowisk: 1Wymiar etatu: 1Miejsce pracy: Gdańsk, ul. Okopowa 21/27Ważne do: 26 maja br.Wynagrodzenie zasadnicze: 7000,00 zł bruttoCzym będziesz się zajmowaćOsoba na tym stanowisku:Przeprowadza kontrole w środowiskowych domach samopomocy w ramach nadzoru nad realizacją zadań zleconych w jednostkach samorządu terytorialnegoSporządza sprawozdania merytoryczne z działalności ośrodków wsparcia oraz ustala limity miejsc ze środków rządowychWspółpracuje z samorządami lokalnymi w celu tworzenia ośrodków wsparcia i usług specjalistycznych dla osób z zaburzeniami psychicznymi oraz ośrodków wsparcia dla ofiar przemocy w rodzinieProwadzi poradnictwo dla jednostek samorządu terytorialnegoUczestniczy w pracach zespołów merytorycznych działających na rzecz realizacji rządowych programów mających na celu ochronę poziomu życia osób, rodzin i grup społecznych zagrożonych wykluczeniem oraz rozwój specjalistycznego wsparcia, zasiada w komisjach i zespołach działających w celu rozwiązania problemów z zakresu pomocy społecznejPrzeprowadza kontrole problemowe w organizacjach pozarządowychKogo poszukujemyPotrzebne ci będą(wymagania niezbędne)Wykształcenie: wyższe Tytuł zawodowy magistra na kierunku lub w zakresie: prawo, administracja, ekonomia, pedagogika, pedagogika specjalna, praca socjalna, socjologia, psychologia, polityka społeczna, politologia, politologia i nauki społeczne, zarządzanie lub marketingStaż pracy co najmniej 3 lata w pomocy społecznej na stanowisku, na którym były realizowane zadania z zakresu pomocy społecznejSpecjalizacja z zakresu organizacji pomocy społecznejZnajomość ustaw: o kontroli w administracji rządowej, o pomocy społecznej, o przeciwdziałaniu przemocy w rodzinie, o ochronie zdrowia psychicznego, o służbie cywilnej, o wojewodzie i administracji rządowej w województwie oraz Kodeksu postępowania administracyjnegoW służbie cywilnej nie może być zatrudniona osoba, która w okresie od dnia 22 lipca 1944 r. do dnia 31 lipca 1990 r.  pracowała lub pełniła służbę w organach bezpieczeństwa państwa lub była współpracownikiem tych organów w rozumieniu przepisów ustawy z dnia 18 października 2006 r. o ujawnianiu informacji o dokumentach organów bezpieczeństwa państwa z lat 1944–1990 oraz treści tych dokumentów - nie dotyczy kandydatek/kandydatów urodzonych 1 sierpnia 1972 r. lub później. Osoba wybrana do zatrudnienia będzie musiała złożyć oświadczenie lustracyjne, jeśli urodziła się przed 1 sierpnia 1972 r.Posiadanie obywatelstwa polskiegoKorzystanie z pełni praw publicznychNieskazanie prawomocnym wyrokiem za umyślne przestępstwo lub umyślne przestępstwo skarboweCo oferujemyMożliwość wyjścia w celu załatwienia ważnej sprawyKarty sportowe lub dofinansowanie zajęć sportowo-rekreacyjnychDopłata do biletów na imprezy kulturalnePomieszczenie lub stojaki na rowery na terenie urzęduDofinansowanie do wypoczynku pracownikówDofinansowanie do wypoczynku dzieci pracownikówDodatek za wysługę lat od 5% do 20% wynagrodzenia zasadniczego, w zależności od udokumentowanego stażu pracyMożliwość dofinansowania do legitymacji ze zniżką 50% na przejazdy PKP, SKM, PKM po przepracowaniu co najmniej 6 miesięcyDodatkowe wynagrodzenie roczne tzw. ""trzynastka""Wsparcie psychologiczneDostępnośćNasz urząd jest pracodawcą równych szans. Aplikacje rozważane są z równą uwagą bez względu na płeć, wiek, niepełnosprawność, rasę, narodowość, przekonania polityczne, przynależność związkową, pochodzenie etniczne, wyznanie, orientację seksualną czy też jakąkolwiek inną cechę prawnie chronioną.Jako osoba z niepełnosprawnością nie możesz skorzystać z pierwszeństwa w zatrudnieniu – nie składaj dokumentu potwierdzającego niepełnosprawność.W miesiącu poprzedzającym datę upublicznienia ogłoszenia wskaźnik zatrudnienia osób niepełnosprawnych w urzędzie, w rozumieniu przepisów ustawy o rehabilitacji zawodowej i społecznej oraz zatrudnianiu osób niepełnosprawnych, wyniósł co najmniej 6%.Warunki pracyWarunki dotyczące charakteru pracy na stanowisku i sposobu wykonywanie zadań:praca administracyjno-biurowa,zagrożenie korupcją,przeprowadzanie kontroli w innych urzędach.Miejsce i otoczenie organizacyjno-techniczne stanowiska pracy:stanowisko pracy zlokalizowane w siedzibie urzędu,pokój biurowy mieści się na drugim piętrze wielokondygnacyjnego budynku, wejście główne do budynku jest wyposażone w podjazd dla osób niepełnosprawnych,na stanowisku pracy nie występują czynniki szkodliwe dla zdrowia, większość czynności jest wykonywana w pozycji siedzącej,praca przy monitorze powyżej 4 godzin dziennie, przy naturalnym i sztucznym oświetleniu, podstawowe wyposażenie na stanowisku to: komputer, telefon, drukarka.Dodatkowe informacjeJeśli zostaniesz zakwalifikowany do kolejnego etapu, powiadomimy Cię o tym mailowo (lub telefonicznie – jeżeli nie podałeś adresu e-mail). Tak samo zrobimy, jeśli nie uda Ci się przejść do dalszego etapu.Oświadczenia podpisz odręcznie i wstaw datę ich sporządzenia.Oferty kandydatów, którzy nie zostali zatrudnieni, zniszczymy po 3 miesiącach od zakończenia naboru. Do tego czasu będzie można je odebrać w urzędzie (ale nie odeślemy ich).Nie rozpatrzymy oferty, którą nadałeś po terminie. Dotyczy to też uzupełniania ofert.Kompletna aplikacja to taka, która zawiera wszystkie wymagane dokumenty i własnoręcznie podpisane oświadczenia.Do dokumentów sporządzonych w języku obcym dołącz kopie ich tłumaczenia na język polski sporządzone przez tłumacza przysięgłego.Nie przesyłaj wszystkich dokumentów, które uznasz, że mogą Ci pomóc w naborze. Prześlij tylko te, których wymagamy lub zalecamy.Zwróć uwagę na warunki pracy, które wskazaliśmy w ogłoszeniu – rzetelnie oceń, czy odpowiada Ci taka praca.Złożone przez Ciebie dokumenty zweryfikujemy pod względem formalnym na podstawie zapisów ogłoszenia dotyczących wymaganych i dodatkowych dokumentów.Informacje o etapach naboru dostępne są na stronie BIP Pomorskiego Urzędu Wojewódzkiego w GdańskuInformacje na temat procedury zgłoszeń wewnętrznych znajdują się na stronie:https://www.gov.pl/web/uw-pomorski/zglaszanie-naruszenPlanujemy następujące metody/techniki naboru:weryfikacja formalna nadesłanych ofert,test wiedzy (opcjonalnie),sprawdzian praktyczny (opcjonalnie),rozmowa kwalifikacyjna.Twoja aplikacja musi zawierać (dokumenty niezbędne)CV i list motywacyjnyKopie dokumentów potwierdzających spełnienie wymagania niezbędnego w zakresie wykształceniaKopie dokumentów potwierdzających spełnienie wymagania niezbędnego w zakresie doświadczenia zawodowego / stażu pracyKopie dokumentów potwierdzających spełnienie wymagania niezbędnego w zakresie specjalizacjiOświadczenie, że w okresie od dnia 22 lipca 1944 r. do dnia 31 lipca 1990 r. kandydatka/kandydat nie pracowała/ł, nie pełniła/ł służby w organach bezpieczeństwa państwa i nie była/był współpracownikiem tych organów w rozumieniu przepisów ustawy z dnia 18 października 2006 r. o ujawnianiu informacji o dokumentach organów bezpieczeństwa państwa z lat 1944–1990 oraz treści tych dokumentów. Nie dotyczy kandydatek/kandydatów urodzonych 1 sierpnia 1972 r. lub późniejOświadczenie o posiadaniu obywatelstwa polskiegoOświadczenie o korzystaniu z pełni praw publicznychOświadczenie o nieskazaniu prawomocnym wyrokiem za umyślne przestępstwo lub umyślne przestępstwo skarboweDołącz, jeśli posiadasz(dokumenty dodatkowe)W przypadku przekazania dokumentu potwierdzającego niepełnosprawność konieczne jest dołączenie oświadczenia o wyrażeniu zgody na przetwarzanie danych osobowych do celów naboru w zakresie wykraczającym poza katalog danych określonych w Kodeksie pracy oraz wynikających z ustawy o służbie cywilnej.Aplikuj do: 26 maja 2025W formie papierowej z dopiskiem:""ogłoszenie nr 151960""na adres:Punkt przyjęć korespondencji w pokoju 24 wkancelarii ogólnej przy wejściu „A"":ul. Okopowa 21/2780-810 GdańskNa kopercie i liście motywacyjnym należy umieścić dopisek: 68/25Dokumenty można składać elektronicznie wyłącznie przez elektroniczną skrzynkę podawczą (ESP) urzędu utworzoną na elektronicznej Platformie Usług Administracji Publicznej (ePUAP) oraz za pomocą e-doręczeń (adres: AE:PL-69276-68927-JEAH).Zasady dotyczące doręczania dokumentów elektronicznych dostępne są na stronie BIP urzędu w zakładce ""Kontakt -> Elektroniczna Skrzynka Podawcza/ eDoręczenia""Zapraszamy również do kontaktu telefonicznego:(58) 30 77 141, (58) 30 77 530Więcej o pracy na stronie urzędu:https://www.gov.pl/web/uw-pomorski/co-oferujemy2Dokumenty należy złożyć do:26.05.2025Decyduje data:stempla pocztowego / osobistego dostarczenia oferty do urzęduAplikując, oświadczasz, że znana Ci jest treść informacji na temat przetwarzania danych osobowych w naborzePrzetwarzanie danych osobowychDANE OSOBOWE - KLAUZULA INFORMACYJNAPrzed przystąpieniem do procesu naboru proszę zapoznać się z klauzulą informacyjną dot. przetwarzania danych osobowych pod adresem: https://www.gov.pl/web/uw-pomorski/jak-zlozyc-dokumenty2",2025-05-25 16:35:44,2025-05-25 16:35:59.295
